,parts,quotes,names,scenes
442,第5部,スゴくいい！いいビンタだ！手首のスナップといい腰の入れ方といい、 こういう元気なビンタを繰り出せるなら、君の健康状態は間違いなく、『良好』 だ！,メローネ,女性に平手打ちでぶたれたときに
443,第5部,"（小便をしている所を指差して）
ここをのぞいてくれよオオオーッ",ナランチャ,変態趣味に走ったときに
444,第5部,これから［飛行機］を盗みたいんだが、それってどの辺に停まっているのかな？,ブチャラティ,乗り物をかっぱらったりハイジャックするときに、道でも尋ねるような雰囲気で
445,第5部,"テメェーッサッサトあの世ヘ
行キヤガレェェェェ
コノクソガアアアァァ
イツマデモコノ世ニ
ヘバリツイテンジャアネェェーッ
コラァァァーッ",スパイス・ガール,相手にあの世に逝って欲しいときに
446,第5部,よこせ！このメスがッ！,ドッピオ,アイスを食べている女の子からアイスを奪い取るときに
447,第5部,オレの「命」は… あの時、すでに終わっていたんだ,ブチャラティ,自分が既に死んでいることを誰かに暴露するときに
448,第5部,"よおーく見せるんだッ！希望が尽きて…　命を終える瞬間の顔をッ！
絶望をわたしの方に向けながら落下していけええええええええええ
うわははははははははははははははははははははははは",チョコラータ,高所から誰か（何か）を突き落とした、もしくは落下させたときに
449,第6部,"「筋肉」は信用できない。
ライフルは「骨」でささえる。",ジョンガリ・A,狙撃中に
450,第7部,"［メェーーーーェ…］
なんだっけ忘れたァァァ
ワハハハハハハハハハハハハハハハッ！
なんだっけなんだっけェェ
ヘヘヘヘヘヘヘヘヘヘ
ヘヘヘヘヘヘヘヘ
ヘヘヘヘヘヘヘヘヘ
えっとなんだっけェェ
エヘヘヘヘヘヘヘヘヘ
ヘヘヘヘヘヘヘヘヘヘ
ヘヘヘヘヘヘヘヘヘヘ
ヘヘヘヘヘヘヘヘヘ
ヘヘヘヘヘヘ
ぜんぜん忘れたァァ
ワハハハハハハハ
ハハハハハハハ
ハハハハハハハハハ
ハハハハハハ",ジャイロ,何だったかぜんぜん忘れたときに
451,第7部,圧迫よォ！呼吸が止まるくらいッ！興奮して来たわッ！早く！『圧迫祭り』よッ！お顔を圧迫してッ！,スカーレット・ヴァレンタイン,顔面騎乗してほしいときに
452,第8部,……よかったァ…ァァ オレのゲロだああああゲロゲロ,東方常秀,自分のゲロを手で受け止めながら
